{
  "schema_version": "2.0",
  "template_key": "company-synthetic-custom-dimension",
  "version": 1,
  "level": "company",
  "scope": {
    "kind": "company",
    "company_id": "00000000-0000-4000-8000-000000000001"
  },
  "parent_ref": {
    "key": "industry-manufacturing",
    "version": 2,
    "sha256": "4ab9f3166ef772e7b5f718c9fcba6a4df175a1f8ccd89dbf50c6af37df199c6d"
  },
  "patches": [
    {
      "dimension": "governance",
      "quality_policy": {
        "evidence_requirement": "issuer_or_regulator_original",
        "freshness": {
          "kind": "age_days",
          "max_age_days": 90
        }
      },
      "reason": "90日行业/企业证据口径示范"
    },
    {
      "dimension": "growth_sustainability",
      "weight": "0.05",
      "reason": "为新增维度保留0.05权重"
    },
    {
      "dimension": "x_customer_retention",
      "weight": "0.05",
      "baseline": {
        "method": "accepted_evidence_rubric",
        "rubric_ref": "customer-retention-synthetic-v1"
      },
      "event_policy": {
        "enabled": true,
        "half_life_days": 90
      },
      "reason": "合成客户留存扩展示范"
    }
  ]
}
